{
  "$schema": "./schema/tokens.schema.json",
  "name": "Design System Glass",
  "id": "dsg",
  "version": 2,
  "prefix": "dsg",
  "cssVarPrefix": "--dsg-",
  "description": "Tokens semánticos del sistema de diseño de vidrio. Fuente de verdad para tokens.css, tailwind/globals.css y la galería.",
  "updated": "2026-10-21",
  "status": "stable",
  "color": {
    "themes": [
      { "id": "dark", "name": "Oscuro" },
      { "id": "light", "name": "Claro" }
    ],
    "tokens": [
      { "name": "canvas", "value": { "dark": "#070b14", "light": "#ecf1fa" }, "usage": "Color base de la página, debajo del fondo de manchas (.dsg-mesh). Tailwind: bg-canvas." },
      { "name": "ink", "value": { "dark": "#eef2f8", "light": "#0b1222" }, "usage": "Texto principal y títulos sobre canvas y sobre cualquier superficie de vidrio. Tailwind: text-ink." },
      { "name": "ink-muted", "value": { "dark": "#aeb8ca", "light": "#36425a" }, "usage": "Texto de apoyo: descripciones, párrafos secundarios, enlaces inactivos del menú. Tailwind: text-ink-muted." },
      { "name": "ink-subtle", "value": { "dark": "#8c97ad", "light": "#4d5970" }, "usage": "Metadatos, fechas, contadores y etiquetas pequeñas. Mínimo 13px. Tailwind: text-ink-subtle." },
      { "name": "glass", "value": { "dark": "rgba(255,255,255,0.055)", "light": "rgba(255,255,255,0.46)" }, "usage": "Relleno de toda superficie de vidrio: cards, paneles, menú, modales. En claro, .dsg-glass añade además un brillo diagonal. Tailwind: bg-glass." },
      { "name": "glass-strong", "value": { "dark": "rgba(255,255,255,0.10)", "light": "rgba(255,255,255,0.72)" }, "usage": "Vidrio elevado dentro de otro vidrio: elemento activo del menú, filas seleccionadas, tags, botón secundario. Tailwind: bg-glass-strong." },
      { "name": "glass-rim", "value": { "dark": "rgba(255,255,255,0.12)", "light": "rgba(255,255,255,0.88)" }, "usage": "Borde de 1px de las superficies de vidrio. En claro es el reflejo blanco que define el borde. Tailwind: border-glass-rim." },
      { "name": "glass-highlight", "value": { "dark": "rgba(255,255,255,0.10)", "light": "#ffffff" }, "usage": "Línea de luz interior en el borde superior del vidrio (inset 0 1px 0). Incluida en shadow-glass." },
      { "name": "line", "value": { "dark": "rgba(255,255,255,0.12)", "light": "rgba(15,23,42,0.11)" }, "usage": "Divisores, bordes de campos, tablas y botones secundarios dentro del vidrio. Tailwind: border-line." },
      { "name": "accent", "value": { "dark": "#5cd2f0", "light": "#0a6a86" }, "usage": "Acción principal, enlaces, estado activo, foco y estado «En desarrollo». Texto encima: on-accent. Tailwind: bg-accent / text-accent." },
      { "name": "accent-warm", "value": { "dark": "#f5b451", "light": "#965700" }, "usage": "Segundo acento: etiqueta de la cinta de noticias, estado «Piloto», badges de pendientes. Texto encima: on-accent." },
      { "name": "on-accent", "value": { "dark": "#04121a", "light": "#ffffff" }, "usage": "Texto e íconos sobre accent, accent-warm, success y admin rellenos." },
      { "name": "success", "value": { "dark": "#6ee7a8", "light": "#0e7346" }, "usage": "Liberado, hito completado, fecha confirmada, impacto conseguido, texto agregado en un diff." },
      { "name": "warning", "value": "{accent-warm}", "usage": "Dependencias críticas, avisos, indicadores demostrativos. Mismo valor que accent-warm; úsalo cuando el significado es de alerta." },
      { "name": "danger", "value": { "dark": "#ff8f80", "light": "#b3311e" }, "usage": "Bloqueos, prioridad alta, rechazos, texto eliminado en un diff. Siempre acompañado de etiqueta o ícono, nunca solo color." },
      { "name": "admin", "value": { "dark": "#b7a4ff", "light": "#5b3fd1" }, "usage": "Identidad de una superficie administrativa: marca «Panel interno», rol ADMIN e ícono activo del menú." }
    ]
  },
  "type": {
    "families": {
      "display": "\"Bricolage Grotesque\", system-ui, sans-serif",
      "sans": "\"IBM Plex Sans\", system-ui, sans-serif",
      "mono": "\"IBM Plex Mono\", ui-monospace, monospace"
    },
    "groups": [
      {
        "name": "Display",
        "family": "display",
        "styles": [
          { "name": "display-xl", "fontSize": "96px", "lineHeight": 0.95, "fontWeight": 700, "letterSpacing": "-0.035em", "sample": "Design System Glass", "usage": "Título del hero en Inicio. En pantalla: clamp(56px, 7vw, 96px)." },
          { "name": "display-lg", "fontSize": "52px", "lineHeight": 1, "fontWeight": 700, "letterSpacing": "-0.03em", "sample": "Proyectos", "usage": "Título de página pública (h1)." },
          { "name": "kpi", "fontSize": "52px", "lineHeight": 1, "fontWeight": 700, "letterSpacing": "-0.03em", "sample": "24", "usage": "Valor de un scorecard." },
          { "name": "heading-lg", "fontSize": "28px", "lineHeight": 1.15, "fontWeight": 700, "letterSpacing": "-0.015em", "sample": "Próximos lanzamientos", "usage": "Título de sección fuera de un panel." },
          { "name": "heading-md", "fontSize": "24px", "lineHeight": 1.2, "fontWeight": 700, "letterSpacing": "-0.01em", "sample": "Avisos importantes", "usage": "Título de un panel de vidrio." },
          { "name": "heading-sm", "fontSize": "20px", "lineHeight": 1.25, "fontWeight": 700, "sample": "Responsables", "usage": "Título de card o de columna lateral." }
        ]
      },
      {
        "name": "Texto",
        "family": "sans",
        "styles": [
          { "name": "body-lg", "fontSize": "17px", "lineHeight": 1.55, "fontWeight": 400, "sample": "Todo lo que el área está construyendo, en un solo lugar.", "usage": "Introducción bajo un título de página, en ink-muted." },
          { "name": "body", "fontSize": "15px", "lineHeight": 1.5, "fontWeight": 400, "sample": "Calculado a partir de hitos completados.", "usage": "Texto base de la interfaz." },
          { "name": "body-sm", "fontSize": "14px", "lineHeight": 1.5, "fontWeight": 400, "sample": "Afecta el hito de piloto.", "usage": "Descripciones dentro de cards y listas." },
          { "name": "caption", "fontSize": "13px", "lineHeight": 1.45, "fontWeight": 400, "sample": "Publicado hace 2 días", "usage": "Metadatos y fechas, en ink-subtle." },
          { "name": "label", "fontSize": "15px", "lineHeight": 1.4, "fontWeight": 600, "sample": "Explorar proyectos", "usage": "Botones, elementos de menú activos y títulos de fila." }
        ]
      },
      {
        "name": "Utilidad",
        "family": "mono",
        "styles": [
          { "name": "eyebrow", "fontSize": "12px", "lineHeight": 1.3, "fontWeight": 500, "letterSpacing": "0.14em", "sample": "INNOVACIÓN · DESARROLLO", "usage": "Antetítulo en mayúsculas sobre un h1, en accent." },
          { "name": "overline", "fontSize": "11px", "lineHeight": 1.3, "fontWeight": 500, "letterSpacing": "0.12em", "sample": "EXPLORAR", "usage": "Encabezado de grupo en el menú lateral, en mayúsculas y ink-subtle." }
        ]
      }
    ]
  },
  "spacing": {
    "note": "Escala de 4px, igual a la de Tailwind: space-4 = p-4 = 16px.",
    "tokens": [
      { "name": "space-1", "value": "4px", "usage": "Separación entre ítems del menú (gap-1)." },
      { "name": "space-2", "value": "8px", "usage": "Gap entre chips y tags (gap-2)." },
      { "name": "space-3", "value": "12px", "usage": "Gap entre ícono y texto, entre botones (gap-3)." },
      { "name": "space-4", "value": "16px", "usage": "Padding de filas y avisos; gap de grids de cards (p-4)." },
      { "name": "space-5", "value": "20px", "usage": "Padding de la página y de cards compactas (p-5)." },
      { "name": "space-6", "value": "24px", "usage": "Padding estándar de una card de vidrio; gap entre secciones (p-6)." },
      { "name": "space-7", "value": "28px", "usage": "Padding de paneles grandes (p-7)." },
      { "name": "space-10", "value": "40px", "usage": "Padding vertical del hero (py-10)." },
      { "name": "space-14", "value": "56px", "usage": "Padding horizontal del hero en escritorio (px-14)." }
    ]
  },
  "radius": {
    "tokens": [
      { "name": "radius-sm", "value": "8px", "usage": "Tags y celdas pequeñas (rounded-lg)." },
      { "name": "radius-md", "value": "14px", "usage": "Elementos del menú, campos de formulario, botones cuadrados de ícono." },
      { "name": "radius-lg", "value": "18px", "usage": "Filas y avisos dentro de un panel." },
      { "name": "radius-xl", "value": "22px", "usage": "Card de vidrio por defecto (.dsg-glass)." },
      { "name": "radius-2xl", "value": "26px", "usage": "Paneles grandes y menú lateral." },
      { "name": "radius-3xl", "value": "32px", "usage": "Hero de Inicio." },
      { "name": "radius-full", "value": "9999px", "usage": "Botones pill, chips de estado, barras de progreso." }
    ]
  },
  "shadow": {
    "tokens": [
      { "name": "shadow-glass", "value": { "dark": "inset 0 1px 0 rgba(255,255,255,0.10), 0 24px 48px -24px rgba(0,0,0,0.70)", "light": "inset 0 1px 0 #ffffff, inset 0 -1px 0 rgba(15,23,42,0.06), 0 0 0 0.5px rgba(15,23,42,0.10), 0 22px 46px -22px rgba(30,52,120,0.38)" }, "usage": "Toda superficie de vidrio: luz superior, canto inferior y sombra difusa. Tailwind: shadow-glass." }
    ]
  },
  "backdrop": {
    "note": "Valores de backdrop-filter. El claro necesita más saturación para que el color de fondo se note a través del vidrio.",
    "tokens": [
      { "name": "backdrop-glass", "value": "blur(22px) saturate(160%)", "usage": "Desenfoque del vidrio en modo oscuro." },
      { "name": "backdrop-glass-light", "value": "blur(26px) saturate(190%)", "usage": "Desenfoque del vidrio en modo claro." }
    ]
  }
}
